{
  "schema_version": "adds.clinical-risk-of-bias-spec.v1",
  "analysis_id": "CHEMBL1743050:MONDO:0008383:acr20-mtx-ir-risk-of-bias:v1",
  "transport_analysis_id": "CHEMBL1743050:MONDO:0008383:mtx-ir-same-stratum-replication:v1",
  "transport_report_integrity_sha256": "3102fa78eec99959e0a2b5025ec5232b7abb2e51c81065fd98be73ec36e7b2cd",
  "endpoint_family": "acr20_response_week_12",
  "outcome_time_frame": "at Week 12",
  "assessments": [
    {
      "trial_id": "NCT02760407",
      "design_id": "NCT02760407:design",
      "endpoint_id": "NCT02760407:endpoint:primary-0",
      "candidate_result_group_id": "OG000",
      "comparator_result_group_id": "OG003",
      "candidate_flow_group_id": "FG000",
      "comparator_flow_group_id": "FG003",
      "citations": [
        {
          "citation_id": "registry_design",
          "source_role": "registry_results",
          "source_document_format": "clinicaltrials.gov-study-v2",
          "source_locator": "https://clinicaltrials.gov/api/v2/studies/NCT02760407",
          "source_content_sha256": "62415b71d08c8d5ccbe0b03be45bad4ad8bd734d43de461be52278314fbb59d8",
          "source_document_date": null,
          "source_field_pointer": "/protocolSection/designModule/designInfo",
          "source_field_sha256": "f261fdd524504956082216c1299b9c81ab83569fc9f0e352eed05768e540a435",
          "source_page": null,
          "source_section": null
        },
        {
          "citation_id": "registry_flow",
          "source_role": "registry_results",
          "source_document_format": "clinicaltrials.gov-study-v2",
          "source_locator": "https://clinicaltrials.gov/api/v2/studies/NCT02760407",
          "source_content_sha256": "62415b71d08c8d5ccbe0b03be45bad4ad8bd734d43de461be52278314fbb59d8",
          "source_document_date": null,
          "source_field_pointer": "/resultsSection/participantFlowModule/periods",
          "source_field_sha256": "7c5d228b4b31703fbedee08f6735d1074815cadf5a7bfd73ab3946ee76f3e39c",
          "source_page": null,
          "source_section": null
        },
        {
          "citation_id": "registry_outcome",
          "source_role": "registry_results",
          "source_document_format": "clinicaltrials.gov-study-v2",
          "source_locator": "https://clinicaltrials.gov/api/v2/studies/NCT02760407",
          "source_content_sha256": "62415b71d08c8d5ccbe0b03be45bad4ad8bd734d43de461be52278314fbb59d8",
          "source_document_date": null,
          "source_field_pointer": "/resultsSection/outcomeMeasuresModule/outcomeMeasures/0",
          "source_field_sha256": "863a3679acd7e1fa1ff977b95906a243702e4b8fc5fda8c5e15ff8a3e105e9ce",
          "source_page": null,
          "source_section": null
        },
        {
          "citation_id": "protocol_randomization",
          "source_role": "protocol_sap",
          "source_document_format": "application/pdf",
          "source_locator": "https://cdn.clinicaltrials.gov/large-docs/07/NCT02760407/Prot_SAP_000.pdf",
          "source_content_sha256": "1b9287681119f071323663b32533fa5eff0195da50bece3fb5e057d71b11cd35",
          "source_document_date": "2018-05-28",
          "source_field_pointer": null,
          "source_field_sha256": null,
          "source_page": 89,
          "source_section": "6.5 Method of Assigning Subjects to Treatment Group"
        },
        {
          "citation_id": "protocol_blinding",
          "source_role": "protocol_sap",
          "source_document_format": "application/pdf",
          "source_locator": "https://cdn.clinicaltrials.gov/large-docs/07/NCT02760407/Prot_SAP_000.pdf",
          "source_content_sha256": "1b9287681119f071323663b32533fa5eff0195da50bece3fb5e057d71b11cd35",
          "source_document_date": "2018-05-28",
          "source_field_pointer": null,
          "source_field_sha256": null,
          "source_page": 95,
          "source_section": "6.12 Blinding"
        },
        {
          "citation_id": "protocol_measurement",
          "source_role": "protocol_sap",
          "source_document_format": "application/pdf",
          "source_locator": "https://cdn.clinicaltrials.gov/large-docs/07/NCT02760407/Prot_SAP_000.pdf",
          "source_content_sha256": "1b9287681119f071323663b32533fa5eff0195da50bece3fb5e057d71b11cd35",
          "source_document_date": "2018-05-28",
          "source_field_pointer": null,
          "source_field_sha256": null,
          "source_page": 54,
          "source_section": "Schedule of Events joint-assessor footnote"
        },
        {
          "citation_id": "sap_missing_data",
          "source_role": "protocol_sap",
          "source_document_format": "application/pdf",
          "source_locator": "https://cdn.clinicaltrials.gov/large-docs/07/NCT02760407/Prot_SAP_000.pdf",
          "source_content_sha256": "1b9287681119f071323663b32533fa5eff0195da50bece3fb5e057d71b11cd35",
          "source_document_date": "2018-05-28",
          "source_field_pointer": null,
          "source_field_sha256": null,
          "source_page": 143,
          "source_section": "9.4.9.1 Primary Analysis of Efficacy Endpoints"
        },
        {
          "citation_id": "sap_primary_analysis",
          "source_role": "protocol_sap",
          "source_document_format": "application/pdf",
          "source_locator": "https://cdn.clinicaltrials.gov/large-docs/07/NCT02760407/Prot_SAP_000.pdf",
          "source_content_sha256": "1b9287681119f071323663b32533fa5eff0195da50bece3fb5e057d71b11cd35",
          "source_document_date": "2018-05-28",
          "source_field_pointer": null,
          "source_field_sha256": null,
          "source_page": 141,
          "source_section": "9.4.7 Primary Efficacy Analysis"
        }
      ],
      "domains": [
        {
          "domain_id": "randomization_process",
          "judgment": "some_concerns",
          "rationale": "The registry and protocol document randomized parallel assignment by blinded staff through automated IWRS allocation. Public sources do not provide the sequence-generation algorithm or an allocation audit.",
          "citation_ids": [
            "registry_design",
            "protocol_randomization"
          ]
        },
        {
          "domain_id": "deviations_from_intended_interventions",
          "judgment": "some_concerns",
          "rationale": "Participant and investigator masking, matched injections, and restricted treatment-code access were planned. Aggregate public sources do not enumerate realized unblinding or all important protocol deviations.",
          "citation_ids": [
            "registry_design",
            "protocol_blinding"
          ]
        },
        {
          "domain_id": "missing_outcome_data",
          "judgment": "low",
          "rationale": "The Week-12 ACR20 denominators equal the randomized STARTED counts in both selected arms, and the SAP classifies premature discontinuation as non-response for binary endpoints.",
          "citation_ids": [
            "registry_flow",
            "sap_missing_data"
          ]
        },
        {
          "domain_id": "measurement_of_the_outcome",
          "judgment": "low",
          "rationale": "The posted ACR20 definition matches the prespecified composite, and the protocol assigns joint counts to an independent assessor blinded to other assessments and dose regimen.",
          "citation_ids": [
            "registry_outcome",
            "protocol_measurement"
          ]
        },
        {
          "domain_id": "selection_of_the_reported_result",
          "judgment": "low",
          "rationale": "The dated protocol/SAP precedes primary completion and prespecifies the Week-12 ACR20 ITT analysis, multiplicity control, risk difference, and 97.5% two-sided interval reported in the registry.",
          "citation_ids": [
            "registry_outcome",
            "sap_primary_analysis"
          ]
        }
      ],
      "overall_judgment": "some_concerns",
      "unresolved_concerns": [
        "The public protocol/SAP does not disclose the IWRS sequence-generation algorithm or allocation audit.",
        "Aggregate public sources do not enumerate realized unblinding or all important protocol deviations."
      ]
    },
    {
      "trial_id": "NCT02760368",
      "design_id": "NCT02760368:design",
      "endpoint_id": "NCT02760368:endpoint:primary-0",
      "candidate_result_group_id": "OG000",
      "comparator_result_group_id": "OG002",
      "candidate_flow_group_id": "FG000",
      "comparator_flow_group_id": "FG002",
      "citations": [
        {
          "citation_id": "registry_design",
          "source_role": "registry_results",
          "source_document_format": "clinicaltrials.gov-study-v2",
          "source_locator": "https://clinicaltrials.gov/api/v2/studies/NCT02760368",
          "source_content_sha256": "7d0f38ee584e2af66cc7b4ebec8d2cc8b86327183a887eba6c5ce1ff96a2d1e7",
          "source_document_date": null,
          "source_field_pointer": "/protocolSection/designModule/designInfo",
          "source_field_sha256": "f261fdd524504956082216c1299b9c81ab83569fc9f0e352eed05768e540a435",
          "source_page": null,
          "source_section": null
        },
        {
          "citation_id": "registry_flow",
          "source_role": "registry_results",
          "source_document_format": "clinicaltrials.gov-study-v2",
          "source_locator": "https://clinicaltrials.gov/api/v2/studies/NCT02760368",
          "source_content_sha256": "7d0f38ee584e2af66cc7b4ebec8d2cc8b86327183a887eba6c5ce1ff96a2d1e7",
          "source_document_date": null,
          "source_field_pointer": "/resultsSection/participantFlowModule/periods",
          "source_field_sha256": "24f6043fb1c056650a84c373b4ebdf4d479a2d737e42a2ea499f6f4f32d3e3b7",
          "source_page": null,
          "source_section": null
        },
        {
          "citation_id": "registry_outcome",
          "source_role": "registry_results",